MCQ,Choices,Correct
What term was coined by Arthur Samuel in 1959 to describe the field of computer gaming and artificial intelligence?,a:Artificial Intelligence | b:Machine Learning | c:Neural Networks | d:Deep Learning,b
"Who published the book 'The Organization of Behavior' in 1949, introducing a theoretical neural structure?",a:Arthur Samuel | b:Donald Hebb | c:Walter Pitts | d:Warren McCulloch,b
What was the name of the experimental 'learning machine' developed by Raytheon Company in the early 1960s?,a:Cyberdyne | b:Cyberspace | c:Cybertron | d:Cybernet,c
Who provided a formal definition of the algorithms studied in the machine learning field?,a:Donald Hebb | b:Walter Pitts | c:Tom M. Mitchell | d:Warren McCulloch,c
What was the main success of neural networks research in the mid-1980s?,a:Reinvention of backpropagation | b:Development of expert systems | c:Abandonment by AI and computer science | d:Connectionism,a
